call mtr.add_suppression("\\[TIDESDB\\].*TDB_ERR_CONFLICT");
CREATE TABLE acct (
id  INT PRIMARY KEY,
bal INT NOT NULL
) ENGINE=TidesDB;
INSERT INTO acct VALUES (1, 100);
connect  s1, localhost, root,,;
connect  s2, localhost, root,,;
connect  s3, localhost, root,,;
#
# TEST 1: two plain reads under REPEATABLE-READ run concurrently,
#         neither takes a lock and neither blocks.
#
connection s1;
SET SESSION transaction_isolation = 'REPEATABLE-READ';
BEGIN;
SELECT bal FROM acct WHERE id = 1;
bal
100
connection s2;
SET SESSION transaction_isolation = 'REPEATABLE-READ';
BEGIN;
SELECT bal FROM acct WHERE id = 1;
bal
100
# Both read successfully -- no lock, no block.
connection default;
SELECT bal FROM acct WHERE id = 1;
bal
100
connection s1;
COMMIT;
connection s2;
COMMIT;
#
# TEST 2: a plain read does NOT block a writer.  s1 keeps an open
#         REPEATABLE-READ snapshot on the row while s3 updates it and
#         commits immediately -- no lock wait.
#
connection s1;
SET SESSION transaction_isolation = 'REPEATABLE-READ';
BEGIN;
SELECT bal FROM acct WHERE id = 1;
bal
100
connection s3;
BEGIN;
UPDATE acct SET bal = bal + 50 WHERE id = 1;
COMMIT;
connection s1;
COMMIT;
connection default;
# 100 + 50 = 150
SELECT bal FROM acct WHERE id = 1;
bal
150
#
# TEST 3: write-intent still locks.  s1 holds SELECT ... FOR UPDATE
#         (X on the row); s3's UPDATE must wait until s1 commits.
#
connection default;
connection s1;
BEGIN;
SELECT bal FROM acct WHERE id = 1 FOR UPDATE;
bal
150
connection s3;
BEGIN;
UPDATE acct SET bal = bal + 1 WHERE id = 1;
connection default;
connection s1;
COMMIT;
connection s3;
COMMIT;
connection default;
# 150 + 1 = 151
SELECT bal FROM acct WHERE id = 1;
bal
151
#
# TEST 4: reads take no lock even with an uncommitted X held.  s1 holds
#         an uncommitted UPDATE (X); s2 under READ-COMMITTED reads the
#         latest committed value without blocking.
#
connection s1;
BEGIN;
UPDATE acct SET bal = bal + 100 WHERE id = 1;
connection s2;
SET SESSION transaction_isolation = 'READ-COMMITTED';
BEGIN;
SELECT bal FROM acct WHERE id = 1;
bal
151
COMMIT;
connection s1;
COMMIT;
connection default;
# 151 + 100 = 251
SELECT bal FROM acct WHERE id = 1;
bal
251
#
# Cleanup
#
disconnect s1;
disconnect s2;
disconnect s3;
connection default;
DROP TABLE acct;
# Done.
