call mtr.add_suppression("\\[TIDESDB\\].*TDB_ERR_CONFLICT");
call mtr.add_suppression("\\[TIDESDB\\].*TDB_ERR_LOCKED");
#
# === Setup: TPC-C district table (simplified) ===
#
CREATE TABLE district (
d_w_id INT NOT NULL,
d_id   INT NOT NULL,
d_next_o_id INT NOT NULL,
d_tax  DECIMAL(4,4),
PRIMARY KEY (d_w_id, d_id)
) ENGINE=TIDESDB;
INSERT INTO district VALUES (1, 1, 3001, 0.1000);
CREATE TABLE orders (
o_id   INT NOT NULL,
o_w_id INT NOT NULL,
o_d_id INT NOT NULL,
o_c_id INT NOT NULL,
PRIMARY KEY (o_w_id, o_d_id, o_id)
) ENGINE=TIDESDB;
CREATE TABLE new_order (
no_w_id INT NOT NULL,
no_d_id INT NOT NULL,
no_o_id INT NOT NULL,
PRIMARY KEY (no_w_id, no_d_id, no_o_id)
) ENGINE=TIDESDB;
CREATE PROCEDURE neword_incr()
BEGIN
DECLARE committed INT DEFAULT 0;
DECLARE tries INT DEFAULT 0;
WHILE committed = 0 AND tries < 1000 DO
BEGIN
DECLARE CONTINUE HANDLER FOR 1180, 1213, 1205 SET committed = -1;
SET committed = 1;
SET tries = tries + 1;
START TRANSACTION;
UPDATE district SET d_next_o_id = d_next_o_id + 1 WHERE d_w_id = 1 AND d_id = 1;
COMMIT;
END;
IF committed = -1 THEN
ROLLBACK;
SET committed = 0;
DO SLEEP(0.001 + RAND() * 0.004);
END IF;
END WHILE;
END|
#
# === TEST 1: Single-session NEWORD (baseline) ===
#
BEGIN;
SELECT d_next_o_id FROM district WHERE d_w_id=1 AND d_id=1 FOR UPDATE;
d_next_o_id
3001
UPDATE district SET d_next_o_id = d_next_o_id + 1 WHERE d_w_id=1 AND d_id=1;
INSERT INTO orders VALUES (3001, 1, 1, 42);
INSERT INTO new_order VALUES (1, 1, 3001);
COMMIT;
SELECT d_next_o_id FROM district WHERE d_w_id=1 AND d_id=1;
d_next_o_id
3002
#
# === TEST 2: Two concurrent NEWORD increments ===
# Both retry on conflict, so both increments land with no lost update.
#
connect  connA, localhost, root,,;
connect  connB, localhost, root,,;
connection connA;
CALL neword_incr();
connection connB;
CALL neword_incr();
connection connA;
connection connB;
connection default;
# Both increments applied via retry: 3002 + 2 = 3004
SELECT d_next_o_id FROM district WHERE d_w_id=1 AND d_id=1;
d_next_o_id
3004
#
# === TEST 3: Serial counter increment (10 iterations) ===
#
# Initial(3004) + 10 = 3014
SELECT d_next_o_id FROM district WHERE d_w_id=1 AND d_id=1;
d_next_o_id
3014
#
# === TEST 4: 4 concurrent NEWORD increments on the same row ===
# Every connection retries on conflict, so the counter advances by 4.
#
UPDATE district SET d_next_o_id = 5001 WHERE d_w_id=1 AND d_id=1;
connect  storm1, localhost, root,,;
connect  storm2, localhost, root,,;
connect  storm3, localhost, root,,;
connect  storm4, localhost, root,,;
connection storm1;
CALL neword_incr();
connection storm2;
CALL neword_incr();
connection storm3;
CALL neword_incr();
connection storm4;
CALL neword_incr();
connection storm1;
connection storm2;
connection storm3;
connection storm4;
connection default;
# All 4 increments applied via retry: 5001 + 4 = 5005
SELECT d_next_o_id FROM district WHERE d_w_id=1 AND d_id=1;
d_next_o_id
5005
#
# === Cleanup ===
#
disconnect connA;
disconnect connB;
disconnect storm1;
disconnect storm2;
disconnect storm3;
disconnect storm4;
connection default;
DROP PROCEDURE neword_incr;
DROP TABLE district;
DROP TABLE orders;
DROP TABLE new_order;
# Done.
